{
  "$schema": "https://veneer.app/schemas/theme-v1.json",
  "name": "Clean Light",
  "description": "The conservative baseline: a neutral slate palette, modest shadows, restrained type. The theme to fork when you want something safe.",
  "author": { "id": "veneer", "name": "Veneer Team" },
  "version": "1.0.0",
  "schemaVersion": 1,
  "tags": ["light", "neutral", "minimal"],
  "license": "MIT",
  "tokens": {
    "color-primary": "#2563eb",
    "color-primary-hover": "#1d4ed8",
    "color-primary-active": "#1e40af",
    "color-primary-subtle": "#eff6ff",
    "color-accent": "#0891b2",
    "color-accent-hover": "#0e7490",
    "color-success": "#16a34a",
    "color-warning": "#d97706",
    "color-danger": "#dc2626",
    "color-info": "#0284c7",
    "color-focus-ring": "#2563eb",
    "color-surface": "#ffffff",
    "color-surface-raised": "#f8fafc",
    "color-surface-sunken": "#f1f5f9",
    "color-surface-overlay": "#ffffff",
    "color-surface-inverse": "#0f172a",
    "color-text": "#0f172a",
    "color-text-muted": "#475569",
    "color-text-subtle": "#94a3b8",
    "color-text-inverse": "#f8fafc",
    "color-text-on-primary": "#ffffff",
    "color-border": "#e2e8f0",
    "color-border-strong": "#cbd5e1",
    "color-border-subtle": "#f1f5f9",
    "radius-sm": "4px",
    "radius-md": "8px",
    "radius-lg": "12px",
    "shadow-sm": "0 1px 2px 0 rgb(15 23 42 / 0.06)",
    "shadow-md": "0 4px 6px -1px rgb(15 23 42 / 0.1)",
    "shadow-lg": "0 10px 15px -3px rgb(15 23 42 / 0.1)",
    "shadow-card": "0 1px 3px 0 rgb(15 23 42 / 0.1)",
    "font-sans": "'Inter Variable', system-ui, sans-serif",
    "font-display": "'Inter Variable', system-ui, sans-serif",
    "spacing": "0.25rem"
  }
}
