{
  "$schema": "https://veneer.app/schemas/theme-v1.json",
  "name": "Terminal",
  "description": "A CRT phosphor terminal: monospace everything, near-black screen, glowing green text, faint scanlines, thin glowing rules instead of shadows, and snappy linear motion. Amber is the only non-green accent.",
  "author": { "id": "veneer", "name": "Veneer Team" },
  "version": "1.0.0",
  "schemaVersion": 1,
  "tags": ["dark", "terminal", "monospace", "retro"],
  "license": "MIT",
  "tokens": {
    "color-primary": "#2ee66b",
    "color-primary-hover": "#4dff8a",
    "color-primary-active": "#1fcc57",
    "color-primary-subtle": "rgb(46 230 107 / 0.15)",
    "color-accent": "#ffb000",
    "color-accent-hover": "#ffc340",
    "color-accent-active": "#e09600",
    "color-success": "#39ff14",
    "color-warning": "#ffd000",
    "color-danger": "#ff5555",
    "color-info": "#00e0ff",
    "color-focus-ring": "#2ee66b",
    "color-surface": "#060a06",
    "color-surface-raised": "#0b110b",
    "color-surface-sunken": "#030503",
    "color-surface-overlay": "rgb(11 17 11 / 0.94)",
    "color-surface-inverse": "#b6ffcf",
    "color-overlay-backdrop": "rgb(0 0 0 / 0.78)",
    "color-text": "#9bffbe",
    "color-text-muted": "rgb(155 255 190 / 0.62)",
    "color-text-subtle": "rgb(155 255 190 / 0.38)",
    "color-text-inverse": "#060a06",
    "color-text-on-primary": "#03140a",
    "color-border": "rgb(46 230 107 / 0.28)",
    "color-border-strong": "rgb(46 230 107 / 0.55)",
    "color-border-subtle": "rgb(46 230 107 / 0.12)",
    "border-width-thin": "1px",
    "border-width-default": "1px",
    "border-width-thick": "2px",
    "radius-none": "0px",
    "radius-xs": "0px",
    "radius-sm": "0px",
    "radius-md": "2px",
    "radius-lg": "2px",
    "radius-xl": "3px",
    "radius-2xl": "4px",
    "radius-3xl": "4px",
    "radius-full": "3px",
    "shadow-2xs": "0 0 0 1px rgb(46 230 107 / 0.2)",
    "shadow-sm": "0 0 0 1px rgb(46 230 107 / 0.25)",
    "shadow-md": "0 0 0 1px rgb(46 230 107 / 0.4), 0 0 18px rgb(46 230 107 / 0.14)",
    "shadow-lg": "0 0 0 1px rgb(46 230 107 / 0.5), 0 0 30px rgb(46 230 107 / 0.2)",
    "shadow-xl": "0 0 0 1px rgb(46 230 107 / 0.6), 0 0 44px rgb(46 230 107 / 0.28)",
    "shadow-2xl": "0 0 0 1px rgb(46 230 107 / 0.7), 0 0 60px rgb(46 230 107 / 0.34)",
    "shadow-card": "0 0 0 1px rgb(46 230 107 / 0.32)",
    "shadow-glow": "0 0 24px rgb(46 230 107 / 0.55)",
    "text-shadow-md": "0 0 6px rgb(46 230 107 / 0.55)",
    "text-shadow-lg": "0 0 10px rgb(46 230 107 / 0.6)",
    "text-shadow-glow": "0 0 8px rgb(46 230 107 / 0.75), 0 0 20px rgb(46 230 107 / 0.4)",
    "font-sans": "'JetBrains Mono Variable', ui-monospace, monospace",
    "font-mono": "'JetBrains Mono Variable', ui-monospace, monospace",
    "font-display": "'JetBrains Mono Variable', ui-monospace, monospace",
    "font-weight-normal": "400",
    "font-weight-medium": "500",
    "font-weight-semibold": "600",
    "font-weight-bold": "700",
    "font-weight-black": "800",
    "tracking-tighter": "-0.02em",
    "tracking-tight": "-0.01em",
    "tracking-normal": "0em",
    "gradient-primary": "linear-gradient(135deg, #2ee66b 0%, #1fcc57 100%)",
    "gradient-accent": "linear-gradient(135deg, #2ee66b 0%, #00e0ff 100%)",
    "gradient-text": "linear-gradient(180deg, #b6ffcf 0%, #2ee66b 100%)",
    "gradient-surface": "repeating-linear-gradient(0deg, #060a06 0px, #060a06 2px, #0a0f0a 2px, #0a0f0a 4px)",
    "duration-fast": "40",
    "duration-default": "90",
    "duration-slow": "160",
    "ease-default": "linear",
    "ease-snappy": "linear"
  }
}
