{
  "$schema": "https://veneerui.dev/schemas/theme-v1.json",
  "name": "High Contrast",
  "description": "An accessibility theme: pure black on white, 2px borders everywhere, sharp corners, enlarged text, and rings instead of soft shadows. Also proves border-width and radius are real theme axes.",
  "author": { "id": "veneer", "name": "Veneer Team" },
  "version": "1.0.0",
  "schemaVersion": 1,
  "tags": ["accessibility", "high-contrast", "light"],
  "license": "MIT",
  "tokens": {
    "color-primary": "#0000ee",
    "color-primary-hover": "#0000cc",
    "color-primary-active": "#000099",
    "color-primary-subtle": "#e6e6ff",
    "color-accent": "#9900cc",
    "color-success": "#006600",
    "color-warning": "#a85400",
    "color-danger": "#cc0000",
    "color-info": "#0000ee",
    "color-focus-ring": "#000000",
    "color-surface": "#ffffff",
    "color-surface-raised": "#ffffff",
    "color-surface-sunken": "#ffffff",
    "color-surface-overlay": "#ffffff",
    "color-surface-inverse": "#000000",
    "color-text": "#000000",
    "color-text-muted": "#000000",
    "color-text-subtle": "#1a1a1a",
    "color-text-inverse": "#ffffff",
    "color-text-on-primary": "#ffffff",
    "color-border": "#000000",
    "color-border-strong": "#000000",
    "color-border-subtle": "#000000",
    "border-width-thin": "2px",
    "border-width-default": "2px",
    "border-width-thick": "4px",
    "radius-none": "0px",
    "radius-sm": "0px",
    "radius-md": "0px",
    "radius-lg": "0px",
    "radius-xl": "0px",
    "radius-2xl": "0px",
    "radius-full": "0px",
    "shadow-sm": "0 0 0 2px #000000",
    "shadow-md": "0 0 0 2px #000000",
    "shadow-lg": "0 0 0 3px #000000",
    "shadow-xl": "0 0 0 3px #000000",
    "shadow-card": "0 0 0 2px #000000",
    "text-base": "18px",
    "text-lg": "20px",
    "text-xl": "24px",
    "text-2xl": "30px",
    "text-3xl": "38px",
    "text-4xl": "46px",
    "text-5xl": "58px",
    "font-weight-normal": "500",
    "font-weight-medium": "600",
    "font-weight-bold": "800",
    "font-weight-black": "900"
  }
}
